{"schema_version":"RaceNote-Forecast-Research-Record-0.4.2","identity":{"target_date":"2026-04-12","venue":"福島","race_no":11,"race_key":"2026-04-12-福島-11","race_name":"福島民報杯","surface":"芝","distance_m":2000,"class":"オープン"},"research":{"evaluation_mode":"BLINDED_HISTORICAL","turn_id":"BTDAY-0027-TURN1-FULLDAY","logic_version":"RaceNote-Human-Context-Reader-0.4.2-candidate","candidate_patch":"mainline + single-shot five-mark forecast","reader_facing_prose_contract":"FORECAST_READER_FACING_PROSE_v0_1","authoring_mode":"MODEL_RACE_BY_RACE_REASONING","prose_origin":"MODEL_AUTHORED_NOT_SCRIPT_GENERATED"},"source":{"racenote_identity":"BTDAY-0027/20260412/福島/11R","racenote_semantic_sha256":"bf9a265c82f8e4410bb71e18edb3af084616f3e0abb62b7a0f2f80cedaf135fc","day_prep_package":"BTDAY-0027_DAY_PREP_20260412_FINAL.zip","reader_input_policy":"TARGET_DAY_MARKET_OBJECT_REMOVED_BEFORE_FORECAST","main_sha_at_forecast":"a70cd028725d304180dabcf8fcd37db5e4505f6b"},"prediction":{"axis":{"horse_no":12,"horse_name":"マイネルモーント","rank":1},"marks":{"main":{"horse_no":12,"horse_name":"マイネルモーント","rank":1},"second":{"horse_no":14,"horse_name":"シルトホルン","rank":2},"third":{"horse_no":13,"horse_name":"バルナバ","rank":3},"others":[{"horse_no":8,"horse_name":"ガイアメンテ","rank":4},{"horse_no":4,"horse_name":"リビアングラス","rank":5}]},"axis_comment":"前走中山1800mで高い水準を示し、2000mでもオープン級の地力がある。","reader_facing_reason":"マイネルモーントは前走中山1800mで高い水準の4着、2000mでも実績がある。シルトホルンは小倉で1800m5着、2000m2着と安定し調教上昇。バルナバは2000m勝ちと2200m勝ちがあり、RRDBの前受け材料もあるため▲で勢いを買った。","stability_counter_reason":null,"concern":null,"full_field_order":null},"decision_trace":{"race_model":"福島芝2000mのオープンで、中距離オープン級の直近水準を中心にし、近走の上昇馬と前受け材料を持つ馬を組み合わせる。","mainline_cases":[{"horse":{"horse_no":12,"horse_name":"マイネルモーント"},"case_for":"前走中山1800mで高い水準を示し、2000mでもオープン級の地力がある。"},{"horse":{"horse_no":14,"horse_name":"シルトホルン"},"case_for":"小倉1800m5着、2000m2着と近況が安定し、調教も上向いている。"},{"horse":{"horse_no":8,"horse_name":"ガイアメンテ"},"case_for":"京都1800m勝ちの地力があり、小倉1800mでも高水準を維持している。"},{"horse":{"horse_no":4,"horse_name":"リビアングラス"},"case_for":"2200～2400mで高い水準を出し、2000m短縮でも先行力を生かせる。"}],"single_shot_case":{"horse":{"horse_no":13,"horse_name":"バルナバ"},"case_for":"小倉2000m勝ちと中京2200m勝ちがあり、前受け材料も含めて勢いを評価。","selected_independently_from_mainline":true},"mark_reason":{"main":"前走中山1800mで高い水準を示し、2000mでもオープン級の地力がある。","second":"小倉1800m5着、2000m2着と近況が安定し、調教も上向いている。","third":"小倉2000m勝ちと中京2200m勝ちがあり、前受け材料も含めて勢いを評価。","others":["京都1800m勝ちの地力があり、小倉1800mでも高水準を維持している。","2200～2400mで高い水準を出し、2000m短縮でも先行力を生かせる。"]},"rrdb_evidence":{"available":true,"reviewed":true,"used_in_decision":true,"recommendation_contract_version":"rrdb-recommendation-signals-v0.3","horse_refs":[{"horse_no":12,"horse_name":"マイネルモーント","source_run_ref":"06262211","recommendation_contract_version":"rrdb-recommendation-signals-v0.3","matched_signal_ids":[],"signal_strength":null,"decision_role":"CONTEXT_ONLY","next_watch_grade":null,"matched_rule_ids":[]},{"horse_no":14,"horse_name":"シルトホルン","source_run_ref":"10261a11","recommendation_contract_version":"rrdb-recommendation-signals-v0.3","matched_signal_ids":[],"signal_strength":null,"decision_role":"CONTEXT_ONLY","next_watch_grade":null,"matched_rule_ids":[]},{"horse_no":13,"horse_name":"バルナバ","source_run_ref":"10261c11","recommendation_contract_version":"rrdb-recommendation-signals-v0.3","matched_signal_ids":["FRONT_SURVIVE_GAP05"],"signal_strength":{"FRONT_SURVIVE_GAP05":{"winner_gap_sec":0.0,"pace_balance_percentile":95.24590163934427,"corner4_frontness":0.8125,"source_finish":1,"source_won":true}},"decision_role":"SUPPORT_REPEATABILITY","next_watch_grade":null,"matched_rule_ids":[]},{"horse_no":8,"horse_name":"ガイアメンテ","source_run_ref":"10261a11","recommendation_contract_version":"rrdb-recommendation-signals-v0.3","matched_signal_ids":[],"signal_strength":null,"decision_role":"CONTEXT_ONLY","next_watch_grade":null,"matched_rule_ids":[]},{"horse_no":4,"horse_name":"リビアングラス","source_run_ref":"06263111","recommendation_contract_version":"rrdb-recommendation-signals-v0.3","matched_signal_ids":[],"signal_strength":null,"decision_role":"CONTEXT_ONLY","next_watch_grade":null,"matched_rule_ids":[]}],"reason_not_used":null},"legacy_0_3_fields":{"status":"NOT_USED_v0.4.2"}},"audit":{"pre_result_guard":"PASS","result_visible_at_freeze":false,"freeze_packager_version":"racenote-freeze-prepared-forecast-0.1.0","created_at":"2026-10-02T03:12:37.187021+00:00","frozen_at":"2026-10-02T03:12:37.187021+00:00","five_mark_role_guard":"PASS","mainline_single_shot_guard":"PASS","reader_facing_prose_guard":"PENDING_VALIDATOR","market_blind_guard":"PASS_TARGET_DAY_MARKET_FIELDS_STRIPPED_BEFORE_FORECAST","rrdb_contract_guard":"PASS_RECOMMENDATION_V0_3_GRADE_DISABLED","prediction_hash_contract":"SEMANTIC_V1_EXECUTION_METADATA_EXCLUDED","prediction_hash":"dffb1f4ff89d240633cb2bb4d1f442361e6a69daf3a2e449376757293f6c657d","prediction_semantic_hash":"dffb1f4ff89d240633cb2bb4d1f442361e6a69daf3a2e449376757293f6c657d"}}
