{"schema_version":"RaceNote-Forecast-Research-Record-0.4.2","identity":{"target_date":"2026-02-15","venue":"京都","race_no":8,"race_key":"2026-02-15-京都-8","race_name":null,"surface":"芝","distance_m":2000,"class":"1勝クラス"},"research":{"evaluation_mode":"BLINDED_HISTORICAL","turn_id":"BTDAY-0025-FULLDAY","logic_version":"RaceNote-Human-Context-Reader-0.4.2-candidate","candidate_patch":"mainline + single-shot five-mark forecast","reader_facing_prose_contract":"FORECAST_READER_FACING_PROSE_v0_1","authoring_mode":"MODEL_RACE_BY_RACE_REASONING","prose_origin":"MODEL_AUTHORED_NOT_SCRIPT_GENERATED"},"source":{"racenote_identity":"BTDAY-0025/20260215/京都/8R","racenote_semantic_sha256":"d1c0dbe0979a5b7742c998af4604687cf294df0c72d2309738c1f0bfba7357ba","day_prep_package":"BTDAY-0025_DAY_PREP_20260215_FINAL.zip","reader_input_policy":"TARGET_DAY_MARKET_OBJECT_REMOVED_BEFORE_FORECAST","main_sha_at_forecast":"613cc8be27a492b8f5a755d3890a6b97fdd02b3a"},"prediction":{"axis":{"horse_no":9,"horse_name":"グレートシール","rank":1},"marks":{"main":{"horse_no":9,"horse_name":"グレートシール","rank":1},"second":{"horse_no":5,"horse_name":"ピースヒロフェイス","rank":2},"third":{"horse_no":6,"horse_name":"メアヴィア","rank":3},"others":[{"horse_no":11,"horse_name":"アレンテージョ","rank":4},{"horse_no":1,"horse_name":"ドルチェリターン","rank":5}]},"axis_comment":"グレートシールは2000mでの安定感が高く、好位から長く脚を使える。京都内回りで最も取りこぼしが少ない形を作れる。","reader_facing_reason":"グレートシールは中距離で位置を確保しつつ脚を残せるのが強み。ピースヒロフェイスは後方から高い上がりを使えるため、前が流れれば最も迫る。メアヴィアは展開に左右される面はあるが、ロスなく運べた時の直線の伸びに妙味があり▲で狙う。","stability_counter_reason":null,"concern":null,"full_field_order":null},"decision_trace":{"race_model":"芝2000mの1勝クラス。内回りでの位置取りと、長く脚を使う持続力を重視し、瞬発力だけの後方馬は割り引く。","mainline_cases":[{"horse":{"horse_no":9,"horse_name":"グレートシール"},"case_for":"2000mで好位から長く脚を使える安定感を評価。"},{"horse":{"horse_no":5,"horse_name":"ピースヒロフェイス"},"case_for":"高い末脚性能があり、差しが届く流れなら逆転まで。"},{"horse":{"horse_no":11,"horse_name":"アレンテージョ"},"case_for":"中距離で大崩れしにくく、連下候補として残す。"},{"horse":{"horse_no":1,"horse_name":"ドルチェリターン"},"case_for":"先行できるため、内回りで位置の利を取れる。"}],"single_shot_case":{"horse":{"horse_no":6,"horse_name":"メアヴィア"},"case_for":"ロスなく立ち回れた時の伸びに魅力があり、展開次第で上振れる。","selected_independently_from_mainline":true},"mark_reason":{"main":"2000mで好位から長く脚を使える安定感を評価。","second":"高い末脚性能があり、差しが届く流れなら逆転まで。","third":"ロスなく立ち回れた時の伸びに魅力があり、展開次第で上振れる。","others":["中距離で大崩れしにくく、連下候補として残す。","先行できるため、内回りで位置の利を取れる。"]},"rrdb_evidence":{"available":true,"reviewed":true,"used_in_decision":true,"recommendation_contract_version":"rrdb-recommendation-signals-v0.3","horse_refs":[{"horse_no":9,"horse_name":"グレートシール","source_run_ref":"09251305","recommendation_contract_version":"rrdb-recommendation-signals-v0.3","matched_signal_ids":[],"signal_strength":null,"decision_role":"CONTEXT_ONLY","next_watch_grade":null,"matched_rule_ids":[]},{"horse_no":5,"horse_name":"ピースヒロフェイス","source_run_ref":"05261112","recommendation_contract_version":"rrdb-recommendation-signals-v0.3","matched_signal_ids":["REAR_HIGH_LAST3F90"],"signal_strength":{"REAR_HIGH_LAST3F90":{"last3f_speed_percentile":90.9090909090909,"winner_gap_sec":0.30000000000001137,"pace_balance_percentile":29.654403567447044,"corner4_frontness":0.09090909090909094}},"decision_role":"SUPPORT_REPEATABILITY","next_watch_grade":null,"matched_rule_ids":[]},{"horse_no":6,"horse_name":"メアヴィア","source_run_ref":"03253209","recommendation_contract_version":"rrdb-recommendation-signals-v0.3","matched_signal_ids":[],"signal_strength":null,"decision_role":"CONTEXT_ONLY","next_watch_grade":null,"matched_rule_ids":[]},{"horse_no":11,"horse_name":"アレンテージョ","source_run_ref":"08261912","recommendation_contract_version":"rrdb-recommendation-signals-v0.3","matched_signal_ids":[],"signal_strength":null,"decision_role":"CONTEXT_ONLY","next_watch_grade":null,"matched_rule_ids":[]},{"horse_no":1,"horse_name":"ドルチェリターン","source_run_ref":"08262307","recommendation_contract_version":"rrdb-recommendation-signals-v0.3","matched_signal_ids":[],"signal_strength":null,"decision_role":"CONTEXT_ONLY","next_watch_grade":null,"matched_rule_ids":[]}],"reason_not_used":null},"legacy_0_3_fields":{"status":"NOT_USED_v0.4.2"}},"audit":{"pre_result_guard":"PASS","result_visible_at_freeze":false,"freeze_packager_version":"racenote-freeze-prepared-forecast-0.1.0","created_at":"2026-10-01T15:56:57.213621+00:00","frozen_at":"2026-10-01T15:56:57.213621+00:00","five_mark_role_guard":"PASS","mainline_single_shot_guard":"PASS","reader_facing_prose_guard":"PENDING_VALIDATOR","market_blind_guard":"PASS_TARGET_DAY_MARKET_FIELDS_STRIPPED_BEFORE_FORECAST","rrdb_contract_guard":"PASS_RECOMMENDATION_V0_3_GRADE_DISABLED","prediction_hash_contract":"SEMANTIC_V1_EXECUTION_METADATA_EXCLUDED","prediction_hash":"f72a8d8aefda38276c96363d9eba06c1a3be6eed323712117b0ca8701318a4f7","prediction_semantic_hash":"f72a8d8aefda38276c96363d9eba06c1a3be6eed323712117b0ca8701318a4f7"}}
