{"schema_version":"RaceNote-Forecast-Research-Record-0.4.2","identity":{"target_date":"2026-02-01","venue":"小倉","race_no":3,"race_key":"2026-02-01-小倉-3","race_name":null,"surface":"ダート","distance_m":1000,"class":"1勝クラス"},"research":{"evaluation_mode":"BLINDED_HISTORICAL","turn_id":"BTDAY-0024-TURN2-FULLDAY","logic_version":"RaceNote-Human-Context-Reader-0.4.2-candidate","candidate_patch":"mainline + single-shot five-mark forecast","reader_facing_prose_contract":"FORECAST_READER_FACING_PROSE_v0_1","authoring_mode":"MODEL_RACE_BY_RACE_REASONING","prose_origin":"MODEL_AUTHORED_NOT_SCRIPT_GENERATED"},"source":{"racenote_identity":"BTDAY-0024/20260201/小倉/3R","racenote_semantic_sha256":"349b4ff065ef56999d387f826ec5f91257311f4e3c9bf8faae99443741cae323","day_prep_package":"BTDAY-0024_DAY_PREP_20260201_FINAL.zip","reader_input_policy":"TARGET_DAY_MARKET_OBJECT_REMOVED_BEFORE_FORECAST","main_sha_at_forecast":"1dc3785cfa53d5dbff39e4d50077336cb138ba44"},"prediction":{"axis":{"horse_no":5,"horse_name":"サツキレジーナ","rank":1},"marks":{"main":{"horse_no":5,"horse_name":"サツキレジーナ","rank":1},"second":{"horse_no":8,"horse_name":"ナムラモモ","rank":2},"third":{"horse_no":10,"horse_name":"ペンテリコン","rank":3},"others":[{"horse_no":7,"horse_name":"レジェンダリーデイ","rank":4},{"horse_no":11,"horse_name":"レストプレドゥモア","rank":5}]},"axis_comment":"札幌1000mを逃げ切り、同距離で3着もある。TIME_CLASS_PLUS1の再評価材料もあり条件適性は明確。","reader_facing_reason":"サツキレジーナは札幌1000mを逃げ切り、その前も同距離3着。1000mでの速さがはっきりしており中心に置く。ナムラモモは福島1150mで先行して3着まで残し、能力評価では最上位。ペンテリコンは前走京都1200mでスタートを躓きながら4着、阪神1200mでも2着があり、1000mで追走が噛み合えば前との差を詰められる。","stability_counter_reason":null,"concern":null,"full_field_order":null},"decision_trace":{"race_model":"1000mらしく序盤の位置取りが重要だが、前走で終いを使えた馬も多く、先行力とロスの少ない差しを両面で見た。","mainline_cases":[{"horse":{"horse_no":5,"horse_name":"サツキレジーナ"},"case_for":"1000m勝ちと3着の実績。距離適性と先行力を最上位評価。"},{"horse":{"horse_no":8,"horse_name":"ナムラモモ"},"case_for":"福島1150m3着で前受けしながら粘った。能力指数も高い。"},{"horse":{"horse_no":7,"horse_name":"レジェンダリーデイ"},"case_for":"福島1150m2着で番手から逃げ馬を追った。スピードは通用。"},{"horse":{"horse_no":11,"horse_name":"レストプレドゥモア"},"case_for":"函館1000m勝ちがあり、近走1200m大敗から距離短縮で見直し。"}],"single_shot_case":{"horse":{"horse_no":10,"horse_name":"ペンテリコン"},"case_for":"1200mで躓きながら4着、前々走2着。短縮で追走が楽なら浮上。","selected_independently_from_mainline":true},"mark_reason":{"main":"1000m勝ちと3着の実績。距離適性と先行力を最上位評価。","second":"福島1150m3着で前受けしながら粘った。能力指数も高い。","third":"1200mで躓きながら4着、前々走2着。短縮で追走が楽なら浮上。","others":["福島1150m2着で番手から逃げ馬を追った。スピードは通用。","函館1000m勝ちがあり、近走1200m大敗から距離短縮で見直し。"]},"rrdb_evidence":{"available":true,"reviewed":true,"used_in_decision":true,"recommendation_contract_version":"rrdb-recommendation-signals-v0.3","horse_refs":[{"horse_no":5,"horse_name":"サツキレジーナ","source_run_ref":"01252503","recommendation_contract_version":"rrdb-recommendation-signals-v0.3","matched_signal_ids":["TIME_CLASS_PLUS1"],"signal_strength":{"TIME_CLASS_PLUS1":{"class_gap_numeric":1.2647058823529487,"time_class_equivalent":"CLASS_1","time_class_equivalent_numeric":2.2647058823529487}},"decision_role":"UPGRADE_RECENT_FORM","next_watch_grade":null,"matched_rule_ids":[]},{"horse_no":8,"horse_name":"ナムラモモ","source_run_ref":"03253408","recommendation_contract_version":"rrdb-recommendation-signals-v0.3","matched_signal_ids":[],"signal_strength":null,"decision_role":"CONTEXT_ONLY","next_watch_grade":null,"matched_rule_ids":[]},{"horse_no":10,"horse_name":"ペンテリコン","source_run_ref":"08261108","recommendation_contract_version":"rrdb-recommendation-signals-v0.3","matched_signal_ids":[],"signal_strength":null,"decision_role":"CONTEXT_ONLY","next_watch_grade":null,"matched_rule_ids":[]},{"horse_no":7,"horse_name":"レジェンダリーデイ","source_run_ref":"03253302","recommendation_contract_version":"rrdb-recommendation-signals-v0.3","matched_signal_ids":[],"signal_strength":null,"decision_role":"CONTEXT_ONLY","next_watch_grade":null,"matched_rule_ids":[]},{"horse_no":11,"horse_name":"レストプレドゥモア","source_run_ref":"09255207","recommendation_contract_version":"rrdb-recommendation-signals-v0.3","matched_signal_ids":[],"signal_strength":null,"decision_role":"CONTEXT_ONLY","next_watch_grade":null,"matched_rule_ids":[]}],"reason_not_used":null},"legacy_0_3_fields":{"status":"NOT_USED_v0.4.2"}},"audit":{"freeze_packager_version":"racenote-freeze-prepared-forecast-0.1.0","created_at":"2026-10-01T14:17:56.495923+00:00","frozen_at":"2026-10-01T14:17:56.495923+00:00","pre_result_guard":"PASS","result_visible_at_freeze":false,"five_mark_role_guard":"PASS","mainline_single_shot_guard":"PASS","reader_facing_prose_guard":"PENDING_VALIDATOR","market_blind_guard":"PASS_TARGET_DAY_MARKET_FIELDS_STRIPPED_BEFORE_FORECAST","rrdb_contract_guard":"PASS_RECOMMENDATION_V0_3_GRADE_DISABLED","prediction_hash_contract":"SEMANTIC_V1_EXECUTION_METADATA_EXCLUDED","prediction_hash":"d50005bb51e748a8488a51cb64006d35cbbb15dcdfc2fb5178a6d07d202d5380","prediction_semantic_hash":"d50005bb51e748a8488a51cb64006d35cbbb15dcdfc2fb5178a6d07d202d5380"}}
