{"schema_version":"RaceNote-Forecast-Research-Record-0.4.2","identity":{"target_date":"2026-02-15","venue":"東京","race_no":6,"race_key":"2026-02-15-東京-6","race_name":null,"surface":"芝","distance_m":2400,"class":"1勝クラス"},"research":{"evaluation_mode":"BLINDED_HISTORICAL","turn_id":"BTDAY-0025-FULLDAY","logic_version":"RaceNote-Human-Context-Reader-0.4.2-candidate","candidate_patch":"mainline + single-shot five-mark forecast","reader_facing_prose_contract":"FORECAST_READER_FACING_PROSE_v0_1","authoring_mode":"MODEL_RACE_BY_RACE_REASONING","prose_origin":"MODEL_AUTHORED_NOT_SCRIPT_GENERATED"},"source":{"racenote_identity":"BTDAY-0025/20260215/東京/6R","racenote_semantic_sha256":"d2cdbe620fb12e98af67f9210e6a1384933513926523c5f852138a643b47b89c","day_prep_package":"BTDAY-0025_DAY_PREP_20260215_FINAL.zip","reader_input_policy":"TARGET_DAY_MARKET_OBJECT_REMOVED_BEFORE_FORECAST","main_sha_at_forecast":"613cc8be27a492b8f5a755d3890a6b97fdd02b3a"},"prediction":{"axis":{"horse_no":4,"horse_name":"ノラリクラリ","rank":1},"marks":{"main":{"horse_no":4,"horse_name":"ノラリクラリ","rank":1},"second":{"horse_no":3,"horse_name":"ティムール","rank":2},"third":{"horse_no":11,"horse_name":"マーゴットソラーレ","rank":3},"others":[{"horse_no":8,"horse_name":"クラッチプレイヤー","rank":4},{"horse_no":13,"horse_name":"トラストボス","rank":5}]},"axis_comment":"ノラリクラリは長めの距離で内容が安定し、終盤の持続力もある。2400mで最も形を崩しにくいと見た。","reader_facing_reason":"ノラリクラリは長距離で急かさず運べる強みがあり、最後まで脚を残す形を作りやすい。ティムールは地力と距離実績でほぼ互角の相手。マーゴットソラーレは前で流れを受けても粘った履歴があり、淡々とした持続戦なら本線の外から残る可能性を▲で狙う。","stability_counter_reason":null,"concern":null,"full_field_order":null},"decision_trace":{"race_model":"芝2400mの1勝クラスで、瞬発力だけでなく長距離での折り合いと持続力を重視。東京の長い直線で脚を使い続けられる馬を選ぶ。","mainline_cases":[{"horse":{"horse_no":4,"horse_name":"ノラリクラリ"},"case_for":"長距離での折り合いと持続力が安定し、東京2400mに適する。"},{"horse":{"horse_no":3,"horse_name":"ティムール"},"case_for":"距離実績と地力があり、直線勝負でも崩れにくい。"},{"horse":{"horse_no":8,"horse_name":"クラッチプレイヤー"},"case_for":"長距離で末脚を残せるタイプで、展開が向けば上位へ。"},{"horse":{"horse_no":13,"horse_name":"トラストボス"},"case_for":"スタミナ面の不安が小さく、相手候補として残せる。"}],"single_shot_case":{"horse":{"horse_no":11,"horse_name":"マーゴットソラーレ"},"case_for":"前傾を前で受けて粘った内容があり、一定ペースなら粘り込みの余地。","selected_independently_from_mainline":true},"mark_reason":{"main":"長距離での折り合いと持続力が安定し、東京2400mに適する。","second":"距離実績と地力があり、直線勝負でも崩れにくい。","third":"前傾を前で受けて粘った内容があり、一定ペースなら粘り込みの余地。","others":["長距離で末脚を残せるタイプで、展開が向けば上位へ。","スタミナ面の不安が小さく、相手候補として残せる。"]},"rrdb_evidence":{"available":true,"reviewed":true,"used_in_decision":true,"recommendation_contract_version":"rrdb-recommendation-signals-v0.3","horse_refs":[{"horse_no":4,"horse_name":"ノラリクラリ","source_run_ref":"08261708","recommendation_contract_version":"rrdb-recommendation-signals-v0.3","matched_signal_ids":[],"signal_strength":null,"decision_role":"CONTEXT_ONLY","next_watch_grade":null,"matched_rule_ids":[]},{"horse_no":3,"horse_name":"ティムール","source_run_ref":"09255607","recommendation_contract_version":"rrdb-recommendation-signals-v0.3","matched_signal_ids":[],"signal_strength":null,"decision_role":"CONTEXT_ONLY","next_watch_grade":null,"matched_rule_ids":[]},{"horse_no":11,"horse_name":"マーゴットソラーレ","source_run_ref":"03253308","recommendation_contract_version":"rrdb-recommendation-signals-v0.3","matched_signal_ids":["FRONT_SURVIVE_GAP05"],"signal_strength":{"FRONT_SURVIVE_GAP05":{"winner_gap_sec":0.30000000000001137,"pace_balance_percentile":78.32369942196532,"corner4_frontness":1.0,"source_finish":5,"source_won":false}},"decision_role":"UPGRADE_RECENT_FORM","next_watch_grade":null,"matched_rule_ids":[]},{"horse_no":8,"horse_name":"クラッチプレイヤー","source_run_ref":"06255707","recommendation_contract_version":"rrdb-recommendation-signals-v0.3","matched_signal_ids":[],"signal_strength":null,"decision_role":"CONTEXT_ONLY","next_watch_grade":null,"matched_rule_ids":[]},{"horse_no":13,"horse_name":"トラストボス","source_run_ref":"05252306","recommendation_contract_version":"rrdb-recommendation-signals-v0.3","matched_signal_ids":[],"signal_strength":null,"decision_role":"CONTEXT_ONLY","next_watch_grade":null,"matched_rule_ids":[]}],"reason_not_used":null},"legacy_0_3_fields":{"status":"NOT_USED_v0.4.2"}},"audit":{"pre_result_guard":"PASS","result_visible_at_freeze":false,"freeze_packager_version":"racenote-freeze-prepared-forecast-0.1.0","created_at":"2026-10-01T15:56:57.213621+00:00","frozen_at":"2026-10-01T15:56:57.213621+00:00","five_mark_role_guard":"PASS","mainline_single_shot_guard":"PASS","reader_facing_prose_guard":"PENDING_VALIDATOR","market_blind_guard":"PASS_TARGET_DAY_MARKET_FIELDS_STRIPPED_BEFORE_FORECAST","rrdb_contract_guard":"PASS_RECOMMENDATION_V0_3_GRADE_DISABLED","prediction_hash_contract":"SEMANTIC_V1_EXECUTION_METADATA_EXCLUDED","prediction_hash":"80d180493f3efd5c38d43a85d875bc091c443390042033f35de1d06568155e9e","prediction_semantic_hash":"80d180493f3efd5c38d43a85d875bc091c443390042033f35de1d06568155e9e"}}
